{
  "schemaVersion": "1.0.0",
  "id": "example-jwt-auth",
  "sourceText": "JWT 인증을 만들어주세요.",
  "intent": {
    "summary": "Spring Security와 JWT를 사용한 인증 시스템을 구현합니다.",
    "action": "implement",
    "primaryDomain": "backend",
    "relatedDomains": [
      "architecture"
    ]
  },
  "context": {
    "audience": "백엔드 개발자",
    "projectState": "신규 Spring Boot API 서버 구현 단계입니다.",
    "techStack": [
      "Spring Boot",
      "Spring Security",
      "JWT",
      "JPA"
    ],
    "assumptions": [
      "Access Token과 Refresh Token을 모두 사용합니다.",
      "비밀번호는 해시로 저장합니다."
    ]
  },
  "requirements": [
    {
      "id": "REQ-1",
      "category": "functional",
      "description": "로그인 성공 시 Access Token과 Refresh Token을 발급합니다.",
      "priority": "must",
      "acceptanceCriteria": [
        "유효한 계정 정보로 로그인하면 두 토큰이 반환됩니다.",
        "잘못된 계정 정보는 인증 실패로 처리됩니다."
      ]
    },
    {
      "id": "REQ-2",
      "category": "security",
      "description": "보호된 API는 유효한 Access Token이 있을 때만 접근할 수 있습니다.",
      "priority": "must",
      "acceptanceCriteria": [
        "토큰이 없거나 만료되면 요청이 거부됩니다.",
        "토큰 검증 실패 사유가 응답에 반영됩니다."
      ]
    },
    {
      "id": "REQ-3",
      "category": "testing",
      "description": "인증 성공, 인증 실패, 토큰 만료 테스트를 포함합니다.",
      "priority": "should",
      "acceptanceCriteria": [
        "인증 흐름의 주요 분기가 테스트로 검증됩니다."
      ]
    }
  ],
  "constraints": [
    {
      "id": "CON-1",
      "scope": "security",
      "description": "비밀번호 원문 저장을 금지합니다."
    },
    {
      "id": "CON-2",
      "scope": "maintainability",
      "description": "Controller는 요청과 응답 매핑만 담당합니다."
    }
  ],
  "outputSpec": {
    "format": "mixed",
    "sections": [
      {
        "title": "프로젝트 구조",
        "description": "인증 관련 패키지와 책임을 설명합니다.",
        "required": true
      },
      {
        "title": "핵심 코드",
        "description": "Entity, DTO, SecurityConfig, Filter, Service, Controller 코드를 포함합니다.",
        "required": true
      },
      {
        "title": "테스트",
        "description": "인증 성공, 실패, 만료 케이스 테스트를 포함합니다.",
        "required": true
      }
    ]
  },
  "validationRules": [
    {
      "id": "VAL-1",
      "description": "JWT 만료와 서명 검증 실패 처리가 분리되어 있는지 확인합니다.",
      "severity": "error"
    },
    {
      "id": "VAL-2",
      "description": "비밀번호 해시 저장과 검증 흐름이 포함되어 있는지 확인합니다.",
      "severity": "error"
    }
  ],
  "qualityScore": {
    "total": 92,
    "max": 100,
    "criteria": [
      {
        "name": "role",
        "score": 10,
        "max": 10,
        "reason": "백엔드 개발자 역할이 명확합니다."
      },
      {
        "name": "requirement",
        "score": 25,
        "max": 25,
        "reason": "토큰 발급, 보호 API, 테스트 요구사항이 분리되어 있습니다."
      },
      {
        "name": "constraint",
        "score": 17,
        "max": 20,
        "reason": "보안과 계층 책임 제약이 포함되어 있습니다."
      },
      {
        "name": "context",
        "score": 15,
        "max": 15,
        "reason": "Spring 기반 인증 맥락이 명시되어 있습니다."
      },
      {
        "name": "outputFormat",
        "score": 10,
        "max": 10,
        "reason": "필요한 산출물 섹션이 정의되어 있습니다."
      },
      {
        "name": "validation",
        "score": 10,
        "max": 10,
        "reason": "보안 검증 규칙이 포함되어 있습니다."
      },
      {
        "name": "technicalSpecificity",
        "score": 5,
        "max": 10,
        "reason": "구체 기술은 충분하지만 저장소 구조는 아직 지정되지 않았습니다."
      }
    ]
  }
}
